Uid,Uname,Like,Level,Content,Time471407065,高紫薇ai,0,4,听说有融号原神的？那个，我缺蒲公英，融完能给我吗,2021-05-20 21:06:48
49099893,匿名陈待,0,5,刻－晴！！！！,2021-05-20 21:06:47
2694048,星辉七海,0,6,欢迎小艾咪和刻师傅加入我们女武神这个大家庭！[打call][打call][打call][打call][打call][打call],2021-05-20 21:06:47
85813047,理の莲华,0,5,德莉莎这服装是人想出来的？强行套？,2021-05-20 21:06:42
20321474,躺地上的不倒翁,0,5,《关于我在崩坏三玩原神这件事》[热词系列_知识增加],2021-05-20 21:06:40
10501304,狸越月巴拉哇咔撕裹依,0,5,米桑真会作呢，是想两边一起烧吧。,2021-05-20 21:06:26
152525014,火花Niv,0,5,原神也当女武神啦[给心心],2021-05-20 21:06:16
39690094,胡萝卜精在这里,0,5,有够2比的,2021-05-20 21:06:12
24975412,真姬我的不接受反驳,0,5,现在还看崩三相关就只是想看怎么死的，好家伙，死前还要拉个垫背的[打call],2021-05-20 21:06:12
11388101,希儿最喜欢的玩具,0,6,守护最好的米桑，蒸蒸日上[打call],2021-05-20 21:06:11
351443553,基德银河初升,0,5,原神和崩坏不会是搞双向联动吧？[辣眼睛],2021-05-20 21:06:03
198718933,墨江Mantra,0,5,元神玩家：别再喊加强雷系了，已经抓了两个去当女武神了！[嗑瓜子],2021-05-20 21:05:52
93900343,一稽之见Geky,0,5,强度方面轮不上刻晴，当女武神上就轮到了[支持],2021-05-20 21:05:48
306320560,阿奇打击很大,0,5,为什么一想到bh3这坨屎能把原神沾臭了，我退游就不感到心痛了呢[思考],2021-05-20 21:05:41
31323713,禽禽禽情兽,0,5,麻了[无语][无语][无语],2021-05-20 21:05:31
259473037,北落poi,0,5,emmm，该不会让小艾咪和刻晴也去当兔女郎吧[doge],2021-05-20 21:05:25
159270567,莫鱼云,0,5,你是真不要那个脸了你个崩三CH还想来祸害原神？,2021-05-20 21:05:25
50938820,淇水之梁,0,6,“女武神”,2021-05-20 21:05:24
17812354,璃-_-曦,0,5,我皇女满命了[doge]不需要你联动[调皮],2021-05-20 21:05:19
22238340,口黑嘿,0,6,"我单方面宣布这是你游自成立以来ch最佳好活！[妙啊]
庆典开始啦各位！",2021-05-20 21:05:15
1808485587,槻木,0,2,双÷狂喜[给心心],2021-05-20 21:05:07
471301849,Owarisune_Hare,0,5,看好了，旅行者，皇女是这样用的[傲娇],2021-05-20 21:05:06
269733139,路过一下的米玖,0,5,wow双厨狂喜了这波,2021-05-20 21:05:04
32766505,冰翼寒,0,4,早死早超生[doge],2021-05-20 21:04:55
1265408757,角边蝴蝶续,0,3,爱了爱了,2021-05-20 21:04:55
37470807,manned_crop1,0,5,这角色卡干嘛用的啊,2021-05-20 21:04:47
410924757,遗晌,0,5,？这波我彻底傻了,2021-05-20 21:06:29
87654943,诸葛寒山,0,5,[打call],2021-05-20 21:06:24
1608019,路过的吃瓜16,0,5,话说mzr，我认为为了一个游戏或是一个游戏公司放弃了自己的立场的人才是真mzr（当然一开始就没有的人当我没说），冲holo和桐生可可的人算mzr吗？如果按mxz们的理论那的确就是，因为冲塔的人妨碍他们看v了。“不爱别伤害”“不爱就离开”“我只是想玩游戏”是mxz的常见论调，但如果代入holo事件mxz们还能把这些话当做道理说的出口吗？冲塔的人就是因为把立场看的比游戏更重才冲塔的，不要再混淆了,2021-05-20 21:06:22
21968323,伊姆芙,0,5,"你以为的：不论多少  就算是敷衍也得留住一点老玩家
实际上：没人了？隔壁韭菜拉一点不就有了？老玩家就特么是服务器蛀虫",2021-05-20 21:06:21
399336990,算了是了,0,4,真会玩[辣眼睛],2021-05-20 21:05:56
44913029,黑星灬乄式,0,6,那边原神玩家还在欣喜好歹保证了安稳的故土，这波啊，这波是正义的背刺，太急着把自家游戏搞臭了，同一家公司，自家游戏，一个德行，同一个民族，一坨稀泥，真寄吧恶心，快爪巴,2021-05-20 21:05:53
7739223,打不死的雷小铭,0,5,Mhy学学库洛吧。,2021-05-20 21:05:46
8234797,真记吧意思没有,0,5,这是在干嘛(゜ロ゜)让阿晴歇歇吧，，，，，,2021-05-20 21:05:40
31135069,猫疯了，不吃鱼,0,5,"外服追进度追了多少版本了，版本没动，追出来一堆特gong，
简中明明版本领先，居然只空降外服部分特gong内容边角料，氪金点，
简中流水最高，专属都没有，
简中有的外服都有，外服有的简中吃点挑挑拣拣的剩饭，
国内耗了两个月，才把更新水晶争取到600，
外服什么都没做转头就给了，这就是公平？
什么时候把问题回应了再来说话，
什么时候道歉了再来谈游戏，
什么时候表态了再来跪，
不然，不管你什么时候来假惺惺，得到的都是战场。
洗地的越来越多了，冷处理永远的神！！！",2021-05-20 21:05:35
26673942,上隔云端,0,6,这联动也不全都不好的，至少剧情能能一键跳过[翻白眼],2021-05-20 21:05:26
383677527,是shiyue啦,0,5,我要搬个小板凳坐这里康康[吃瓜],2021-05-20 21:05:14
202606127,壬生狼-Okita,0,5,牛哇牛哇[笑],2021-05-20 21:04:53
1561746,KianaKasIana,0,6,崩坏3加油 原神加油 米哈游加油,2021-05-20 21:04:53
31135069,猫疯了，不吃鱼,0,5,"道歉直播真就这么难？

把所有问题汇总表态就这么难？

米哈游自己站出来承受玩家怒火就这么难？

不要拉二创挡枪就这么难？

我知道，原神赚钱了，

崩3没有以前那么重要了，

只要牺牲几个月流水事情也就慢慢淡了，

你米哈游能承担这个损失了，

我们之前的投入，对你的期望都成了笑话，

你连站出来编一个精巧的谎言都不愿做了，

我们究竟做了什么需要你这样对待？？？",2021-05-20 21:04:47
11176034,外来者のケーキ,0,6,菲谢尔和氪晴，还有可莉的衣服算是彻底火了[微笑],2021-05-20 21:04:44
28565420,加奈美赛高,0,6,屎上＋屎,2021-05-20 21:04:43
432340556,刮痧第一人,0,3,这个时候联动，你脑子没问题？,2021-05-20 21:04:38
24156812,你家蟑螂死了吗,0,5,这女武神怎么这么像奥托大人[吃瓜],2021-05-20 21:04:32
20653079,咸鱼096,0,5,[辣眼睛],2021-05-20 21:04:23
7952471,好喝不过冰红茶,0,6,转发比评论多还行？[嗑瓜子],2021-05-20 21:03:55
15265011,还在秋,0,5,十年老粉不请自来,2021-05-20 21:04:54
341253168,Biu_小黄鸦,0,5,这是单向又不是双向联动，咋一堆又出来喷原神的，真就石乐志了？[疑惑]服了,2021-05-20 21:04:54
31927085,马猴烧酒Mashiro,0,6,你真的把爷给整吐了,2021-05-20 21:04:54
87150055,nicotine本位,0,5,换游戏，怎么换游戏，我那么多游戏为什么要换一个玩？,2021-05-20 21:04:48
288589487,崇宮假那,0,5,不是说联动原神有问题，他现在根本就不配和任何东西联动明白吗？自己的事情还没处理清楚净想着阴间活挣钱真tm寒碜 冲崩三就好了，冲原神属实脑瘫,2021-05-20 21:04:44
306320560,阿奇打击很大,0,5,你老婆去当女武神了[嗑瓜子],2021-05-20 21:04:43
96282288,改名的葬訫丷,0,5,sb崩三策划，hetui [嫌弃],2021-05-20 21:04:34
34763826,禾盛,0,6,真的垃圾，纯复制粘贴,2021-05-20 21:04:20
262393989,小发同学,0,5,呜呜呜，米桑把我评论删了，不要阿[大哭][大哭],2021-05-20 21:04:17
3209326,ChrisQ2nd,0,6,好的，以后一键快进到全部miholo的产品角色都是兔女郎，包括男性角色[doge][doge][doge],2021-05-20 21:04:05
112930945,何天记,0,5,鬼泣联动塞尔达啊嗯，林克打不过魔人化维吉尔怎么办,2021-05-20 21:04:00
34848618,蕾米利亚・斯卡雷特,0,5,米桑，不愧是你,2021-05-20 21:03:58
343579722,下饭且管饱66,0,4,崩坏三恶不恶心啊？自己烂了拉着别人下水？,2021-05-20 21:03:51
317749531,ゆめYume1221,0,5,你寄吧谁啊,2021-05-20 21:03:47
8203306,墨染几何,0,6,这联动有了让我回坑的想法，但一想到官方的态度还是算了吧[tv_白眼],2021-05-20 21:03:11
1523741,无人之岛的猫,0,6,真的垃圾，沙币崩坏3,2021-05-20 21:03:09
73850341,柑橘白夜行,0,5,能不能给刻晴来个国外特供兔女郎？[嗑瓜子],2021-05-20 21:03:07
178729084,開天仁,0,5,本来融了玩原神两互不相关就算了，出了这事还搞这出，真被你ex完了米桑，以后都不会氪一分钱，当蛆虫算了[阴险],2021-05-20 21:02:59
3012542,毛玉Kedama,0,6,米哈游:此地已战乱如此，不如再加一把，哈哈哈哈哈哈哈哈！,2021-05-20 21:02:53
477044496,星球世界,0,4,"对不起
对不起
对不起
当初联动意向问卷调查我填了原神
对不起
对不起
对不起
对不起
在此给大家诚挚的道歉
我是伞兵
(此条为转发)",2021-05-20 21:02:51
15768841,whyleon5,0,6,好耶！双厨狂喜[热词系列_好耶],2021-05-20 21:02:38
512905631,_Constellation-,0,3,原神要是被搞的和你一样烂，赶紧退钱吧，没那必要稀罕你那二刺猿了[微笑],2021-05-20 21:04:30
3433301,帝国圆手,0,6,你隔这炸粪坑呢,2021-05-20 21:04:30
193534519,七十二柱魔神吉蒙里,0,5,转发比评论多[无语],2021-05-20 21:04:23
24369785,希儿酱天下第一,0,5,mhy加油,2021-05-20 21:03:49
24369785,希儿酱天下第一,0,5,这转发量怎么可能凉呢,2021-05-20 21:03:38
130654,莲华.出淤泥而不染,0,6,援批蚌埠住了,2021-05-20 21:03:33
247975821,一曲璃歌谱半生,0,5,这次联动米桑不会以为评论区全是双厨狂喜吧😄,2021-05-20 21:03:26
3036951,神之COMBB,0,3,过去的事，交给岁月去处理；将来的事，留给时间去证明。我们真正要做的，就是牢牢地抓住今天，让今天的自己胜过昨天的自己。,2021-05-20 21:03:18
8557856,无泪沟,0,5,刻师傅命座做的一塌糊涂，也不知道改，传说任务也没有，也就颜值撑起五星，真就把她当成赚钱的工具了呗,2021-05-20 21:03:00
15207951,吹不散眉弯H,0,5,让我中吧中了次次三连，啊啊啊球球了，QAQ给爷中，我怎么会不中呢[doge]，up我爱死你了，嘤嘤嘤人家想要啦，可以让我中一次吗，这里这里,2021-05-20 21:02:55
477044496,星球世界,0,4,联动，然后成为女武神,2021-05-20 21:02:43
2359039,辉夜葉,0,6,笑了，s没啥用ss不见强3s没必要,2021-05-20 21:02:39
1970395786,溺水的嘤嘤怪,0,2,[吃瓜],2021-05-20 21:02:37
26557977,ThanatusGF,0,5,？？？？？？？,2021-05-20 21:02:34
483421265,要下雨了--,0,4,这个德丽莎皮肤还是别了吧，我炸开了， 可莉很好看 ，德丽莎很好看，加起来怎么就这么奇怪阿！！！！！,2021-05-20 21:02:27
10774930,浅墨染清歌,0,6,[热词系列_好家伙]自家联动，是个好东西。[热词系列_梦幻联动][热词系列_可以][热词系列_妙啊],2021-05-20 21:02:24
274219570,明夕玦-,0,5,爱酱中午好,2021-05-20 21:02:23
27620892,科技管理科,0,5,双厨狂喜,2021-05-20 21:02:17
341906237,SpirituaApathy,0,5,rnmg!,2021-05-20 21:02:07
145541482,冰封丶百里,0,5,"低情商：皇女和刻晴当女武神喽
高情商：刻晴有传说任务了（指崩3）
低情商：刻晴什么时候出专武啊
高情商：刻晴终于有专武了（指崩3天極之钥）
低情商：崩3出问题管我原神什么事？
高情商：你好，原（来你也是女武）神 玩家",2021-05-20 21:02:04
34680917,西红柿の幽幽子_,0,5,还看不出来吗，mhy已经。。放弃国服，反正国服现在只要还开着就有着不错的营收，以后专心拓宽外服业务就好了，可悲,2021-05-20 21:02:04
702381,伊德婭,0,6,双厨狂喜[星星眼],2021-05-20 21:02:01
37868619,无奈的大王,0,6,提纯大师,2021-05-20 21:03:44
234343922,HQT丶瓜皮藻,0,5,我我我我想要这个,2021-05-20 21:03:42
1713438952,汐兰兰兰兰兰兰,0,2,煞笔,2021-05-20 21:03:40
471407065,高紫薇ai,0,4,差不多得了，我觉得这个联动是早就定下的，我应该会去崩3体验一下刻晴，正好还有号,2021-05-20 21:03:34
326894919,是阿熊,0,5,米忽悠能不能4000+？😅,2021-05-20 21:03:31
13881375,赞美伪娘,0,5,天王老子来了我也要说双厨狂喜,2021-05-20 21:03:30
20180460,DU紫黄,0,5,融完可以给我当矿号吗[脱单doge],2021-05-20 21:03:25
30411260,还是玉米好吃,0,5,原神——原来你也是女武神,2021-05-20 21:03:24
185430222,感觉还行z,0,5,原来你也是女武神,2021-05-20 21:03:21
35735428,LuEnkv,0,6,[呲牙]牛逼，双向退坑！！！好耶！！！[呲牙]以后爷再碰你们米哈游的游戏，也就是煞笔[呲牙],2021-05-20 21:03:19
162920569,NPC播放机,0,5,转发8500评论6800？什么高强度删评,2021-05-20 21:03:18
481693710,盗亦无道秋墨雪,0,3,专武不是天空之弓没那味【暴露了我非酋的本质】[笑哭],2021-05-20 21:03:14
51290541,NASA由崎司,0,5,芭芭拉和琴的皮肤不是还没实装么，怎么就出兔女郎小艾米刻晴了[呲牙],2021-05-20 21:03:09
12786434,不知道发生了什么事,0,5,德莉莎的皮肤也太生草了吧[热词系列_知识增加],2021-05-20 21:03:04
388285217,梦の光玉,0,5,大家伙告诉我，这次是直播还是又是录播？,2021-05-20 21:03:02
12509540,风雨门,0,6,水越来越混了，以后轮到小艾米和刻晴做特供了[大哭],2021-05-20 21:03:00
340377651,小碳sw,0,5,真恶心[傲娇]恶心死了[傲娇]你们这个策划想问一下是什么大人物啊😅这么会联动啊？就不怕哪天被人给刀了？,2021-05-20 21:02:54
97904890,一生闷响,0,5,miHoYo真的好温柔，我真的哭死[撇嘴],2021-05-20 21:02:50
12386538,墨路人生,0,6,在？崩坏3日服打算在日本复刻几次公历7.7，公历9.18，公历12.13的活动？[笑],2021-05-20 21:02:46
40994939,风扫叶落,0,5,你们崩坏三热度真高，半个小时就几千评论[doge],2021-05-20 21:02:39
39879875,RTX-4080Ti,0,6,伞兵[滑稽],2021-05-20 21:02:31
3209326,ChrisQ2nd,0,6,一键快进到崩三mxz和援神mxz对线[doge][doge][doge],2021-05-20 21:02:21
36420591,桜木ひな子,0,5,这公司💊,2021-05-20 21:02:19
338390103,iTwilightSnOw,0,5,什么？刻晴也缺钱了？,2021-05-20 21:02:13
298008366,鱼中的水瓶,0,5,怎么办？我有一点想回去了，快来个人劝劝我吧！,2021-05-20 21:02:12
60521701,落红嫣有情,0,5,原神=女武神训练场,2021-05-20 21:02:06
27599758,沉船老祖,0,5,我希望明天首页能出现一堆原神融号的视频,2021-05-20 21:01:55
147996704,欧文-阿波卡利斯,0,5,有无老哥发一下刻晴和菲谢尔兔女郎装跳舞的视频啊？怎么评论区都看了就我没看？,2021-05-20 21:01:43
8190545,繁星的眷恋,0,5,"emmm,我感觉你们是打算再憋?啥来着?用行动证明一切?5.0版本才是绝杀是吧，上次新角色让我高呼是迷迭，也是我退坑的版本，很嘲讽我还刚好进了4.2的测试服……一张纸有了黑点你内容写的再好，那个黑点也没办法去除。呼……呵呵呵，还有两个月呢，给点回应吧，内测玩出来的真的不忍心看到这个模样，唉……863768舰长，呵，丹樱，呵，轩辕.戏水，呵",2021-05-20 21:01:33
1693893326,账号已注销,0,0,米桑你太能整活了，建议联动加一个芭芭拉😃😃😃,2021-05-20 21:01:26
369322861,喜欢斗子的小汐,0,5,单向我可以,2021-05-20 21:02:19
179695471,冬瓜呱O3O,0,5,不好意思，我想笑,2021-05-20 21:02:12
1025088896,はれな,0,2,TTK！,2021-05-20 21:02:08
59114663,阿伽松,0,3,加速！,2021-05-20 21:01:56
506776636,依呀依呀yo,0,4,认真问一句，那些维护mhy的人维护的到底是哪一点啊？,2021-05-20 21:01:54
1016564235,Gdsk陆柒,0,3,该有个结果了,2021-05-20 21:01:48
1519489770,タイキシャトル,0,2,好,2021-05-20 21:01:34
437917165,无人唤明兄,0,4,啊啊啊啊啊啊啊啊啊啊啊啊啊啊啊啊啊啊啊啊啊啊啊啊啊啊啊啊啊啊啊不要啊!!!!!!!,2021-05-20 21:01:33
275710199,孤傲的炎龙皇天,0,5,开门绣衣指使，皇上要见你[生气][生气][生气][生气],2021-05-20 21:01:09
7945244,24岁社畜,0,6,[辣眼睛]闻讯而来。。。这评论区怎么说呢怪怪的,2021-05-20 21:01:00
86594306,朝空之星,0,5,德丽莎cos可莉，花玲yyds[喜欢],2021-05-20 21:00:59
399848692,白嫖怪-独白,0,4,我只想说一句话，我是个散兵[给心心],2021-05-20 21:00:52
14994627,倾音渠眸,0,5,联动？污泥浊水,2021-05-20 21:00:41
39316242,真理在上,0,5,只玩原神表示你联动的是nm 米大人可太会了,2021-05-20 21:00:30
630362327,-KlN-,0,4,好耶,2021-05-20 21:00:28
1551391,古茨新菜,0,6,这次直播的水晶码谁有？,2021-05-20 21:00:25
54938017,天授酒,0,6,别联了，别联了，球球了,2021-05-20 21:00:20
2130561,davidxxy,0,6,原来你也是女武神[doge],2021-05-20 21:00:16
436349027,苜蓿花蜜,0,5,你就是联动一个班尼特也行啊！,2021-05-20 21:00:16
434677945,再睡一夏あ,0,4,"我这里分析一波 
皇女 雷系 奥兹发射器 sp角色
懂的都懂 雷观星？
雷律体系成熟 渡鸦 雷系 实装很高概率
懂的都懂 为以后做铺垫？
那么就差火观星了？",2021-05-20 21:00:05
436349027,苜蓿花蜜,0,5,女人只会影响我击剑的速度，我的队伍里全是男的,2021-05-20 21:00:00
366704143,白色系奶茶,0,5,快进到刻晴当兔女郎,2021-05-20 20:59:57
12437515,伸手碰星光,0,5,本人原神玩家，没玩过崩三，感觉被恶心到了[无语],2021-05-20 21:01:46
244149679,尚书画廊,0,5,"很喜欢一个只存在16s的热评:
miHoYo仅花了三个月时间追上了鹅厂猪场十几年的名声[呲牙][呲牙]",2021-05-20 21:01:40
281050977,小半橛儿,0,5,[嗑瓜子],2021-05-20 21:01:34
325180807,若莲墨羽,0,5,我要刻晴常驻,2021-05-20 21:01:28
161962402,丨自灬定义,0,5,鸡坏3：原神，是兄弟就一起下海！看见你赚钱比我亏钱还难受，我要跟你同归于尽ψ(｀∇´)ψ,2021-05-20 21:01:23
20552807,K423丶西琳,0,5,可以在蒙德酒馆里看可莉穿兔女郎装指日可待了!,2021-05-20 21:01:23
110729542,仙人抚我顶抚完没头发,0,5,呸,2021-05-20 21:01:17
6459656,十四姐,0,6,一个月就完成了角色怪物文本BOSS技能一系列准备，mhy太强啦！  这些“玩家”可真机灵,2021-05-20 21:01:15
854248,黄昏の天空,0,5,如果我得了绝症，我就去跟崩3ch一换一,2021-05-20 21:01:10
29066591,凛秋水,0,4,又脏又臭，蚌埠住了,2021-05-20 21:01:06
246212431,斯卡里茨掘墓人,0,5,韬光养晦都不会真不懂啊,2021-05-20 21:01:03
14018179,双鱼一二三,0,5,你们请的什么🎤策划啊，鸵鸟人是吧,2021-05-20 21:00:57
506870381,king丶极星,0,3,这波，这波是要死一起死啊[疑惑][疑惑],2021-05-20 21:00:52
13195707,冲烂米忽悠我套你猴子,0,5,鸡场真有你的,2021-05-20 21:00:52
400886625,潜伏之混沌,0,5,这样太恶心了,2021-05-20 21:00:49
20180460,DU紫黄,0,5,缺个矿号，1元卖我呗,2021-05-20 21:00:35
37658827,晴れ晴れや,0,5,原来你们都要mhy的道歉和会改的态度？？就我一个只想它死？？,2021-05-20 21:00:32
436968639,蝶俐蝶俐,0,4,😅我是nt，之前居然还想着为崩三说话，笑嘻嘻了，崩三就赶紧死吧😅,2021-05-20 21:00:25
284986372,bms54419,0,5,唉……你在和我开玩笑吗……,2021-05-20 21:00:16
134619283,带着北瓜去西京,0,5,真好呢，可惜啊，人心若是烧没了……,2021-05-20 21:00:10
18679653,暴怒胡椒粉,0,6,冲鸭,2021-05-20 21:00:08
1025088896,はれな,0,2,双chu狂洗！,2021-05-20 20:59:43
701269483,风雨飘摇的过客,0,2,垃圾场的垃圾不要乱飞，自己腐烂就好,2021-05-20 20:59:35
151365450,gyujpp,0,5,ttk，ttk[打call],2021-05-20 20:59:30
677603194,愚蠢的名称,0,2,看我动态,2021-05-20 20:59:17
281422158,yourdeardada,0,5,菲谢尔什么时候变成兔女郎跳舞啊,2021-05-20 21:01:10
258094568,Ayame单推人,0,5,不会真有人转发去拿个骨灰罐吧,2021-05-20 21:01:09
262393989,小发同学,0,5,米桑米桑，我想看到旅行者也变成女武神[大哭][大哭],2021-05-20 21:00:54
395847487,克利夫兰最可爱,0,5,这都能联动[喜极而泣],2021-05-20 21:00:33
13353739,艦長這邊請,0,5,别说tx内鬼了，你就是说你是tx的子公司，是专门衬托tx的我都信了[吃瓜],2021-05-20 21:00:15
84484685,泥头车驾驶人,0,5,鸡厂干脆把你旗下的游戏一起联动 都搞臭它算了,2021-05-20 21:00:12
11999538,你所爱我所忆,0,5,不送钟表了？？？,2021-05-20 21:00:03
348457809,菜津奈,0,5,这操作给我整不会了都,2021-05-20 20:59:59
49759640,左垣环,0,5,我崩坏3死了你原神还想活着？------崩坏3ch,2021-05-20 20:59:52
286784436,-Seniorious-,0,5,刻师傅😭被两头压榨，已经一滴价值都不剩了,2021-05-20 20:59:47
85320935,譞影易,0,5,你就是这么对待我们老玩家的？  直接就放弃了？,2021-05-20 20:59:46
12110109,嘎嘣脆皮鸭鸭鸭,0,5,你疯了？,2021-05-20 20:59:42
458225482,Bo良Kiss影,0,4,这波节奏要是撑不下来，两个IP就等着一起暴毙吧[辣眼睛],2021-05-20 20:59:41
287745632,末辰啊,0,5,这波是拉兄弟下水啊，傻逼,2021-05-20 20:59:40
351380521,杨子杉,0,4,笑笑不说话,2021-05-20 20:59:31
291854426,小鼬子呦,0,5,求下兑换码,2021-05-20 20:59:30
116565754,爱吃青菜的李仔,0,4,[喜欢],2021-05-20 20:59:21
14201898,爱民如子小七酱,0,6,好盾啊，好盾,2021-05-20 20:59:16
2694048,星辉七海,0,6,欢迎小艾咪和刻师傅加入我们女武神这个大家庭！[打call][打call][打call][打call][打call][打call],2021-05-20 20:59:13
39694647,小白儿コ,0,5,米桑36000+[给心心],2021-05-20 20:59:51
27158615,电竞周敦颐RoTz,0,5,今天彩6入门练习练的好好的，突然公会群吹比群csgo群方舟群各种消息我还寻思这是公会战消息真男酮进群幺宝开14卡托方舟新pv撞一起了？结果一看齐刷刷三崩子联动原神[笑哭][笑哭]现在只庆幸这次原神新池子没氪金[OK],2021-05-20 20:59:48
8094116,神怜です,0,6,在 是不是没活了没活了没活了？,2021-05-20 20:59:28
677603194,愚蠢的名称,0,2,看我动态。。,2021-05-20 20:59:25
647021032,_绫濑赛高_,0,3,万万没想到这种风口浪尖上会把自家另一个游戏拉下水…要死一起死是吧？,2021-05-20 20:59:06
37939985,米哈游爬,0,5,【崩三（日服）抽卡这就是没保底吗 爱了爱了-哔哩哔哩】https://b23.tv/XftnRp,2021-05-20 20:59:05
7773022,西住美穗さま,0,5,抽了,2021-05-20 20:59:02
377985977,坏土废墟,0,5,光明正大的提纯，真正的爱玩玩不玩滚蛋，以前觉得mhy比起tx好点，现在mhy这尿性比tx还NB，把玩家脸摁地上摩擦，福利是不可能改的，高层也不会道歉的，我们有NB的产品啊，玩家不想用也得用，反正有xz洗,2021-05-20 20:58:42
356438695,汪柴-,0,4,啊，崩坏，别碰他，啊啊啊，啊啊啊啊，原神，啊啊啊啊,2021-05-20 20:58:34
26368058,柒屿椛アギ,0,5,好家伙热评一直删！大家赞我我也想被删[doge],2021-05-20 20:58:30
35113106,bili_35113106,0,5,https://b23.tv/C8ihBI,2021-05-20 20:58:29
289212837,老吴神,0,3,原神是我入坑的第一款二次元游戏，别的二次元游戏真的没有那种坚持玩下去的动力，希望ch不要在原神上搞出什么联动崩三这类的阴间操作了，单方联动就算了，如果真是这样，我宁愿氪到鹅厂猪厂上去,2021-05-20 20:58:29
702744000,Ustinianea,0,3,双厨狂喜[热词系列_梦幻联动],2021-05-20 20:58:28
25671892,Gons丶王牌,0,5,这波联动是想拉袁批救场吗？哈哈哈哈或[滑稽][滑稽][滑稽],2021-05-20 20:58:17
272048748,刻晴刻晴刻,0,5,👴🏻的刻晴咋成女武神了[大哭][大哭][大哭],2021-05-20 20:57:49
176010358,子常常常常,0,5,这波是对立两个游戏的玩家了，我这一个两个都玩的实在是裂开,2021-05-20 20:57:42
32980096,地球常客之父,0,6,原来你也是女武神,2021-05-20 20:57:39
4522011,樽非鳟,0,5,崩3这滴脏得不能再脏的墨水滴入了原神这杯能饮用的清水中......,2021-05-20 20:57:35
107831832,看见我记得催我去睡觉,0,5,啥b,2021-05-20 20:57:34
434918313,早见雪乃,0,4,看了一些评论，也发现一些mxz，建议他们看看b站新买的日剧—《某年某班》，说实话你们跟那个网站上的人的素质差不多。,2021-05-20 20:57:33
89018615,无敌地头蛇,0,5,万一,2021-05-20 20:59:08
77973850,欧利蒂斯庄园开箱up主,0,5,听说很多人要融号，不如都五毛卖给我，我真不是要贪小便宜。等我攒够了一百个全图鉴的号，立马出视频。兄弟们赞我，让更多的人看到[打call][打call],2021-05-20 20:58:53
266057601,此名价6币,0,5,评论区每人都欠我个熔号视频,2021-05-20 20:58:49
37005618,江宁雨中,0,5,哈哈哈又开始整活了 米桑别急 你司游戏爷已经停氪了 崩坏三正在出号回血 原神等爷玩腻了再跑 现在就当个服务器蛀虫[吐],2021-05-20 20:58:31
19467877,梦梦samaya,0,5,根本没什么事，真觉得网上嗓门大的就牛比？一群打着正义之名，却干着low穿下限的事的人算个什么东西，一个评论区一个人发几千条评论人多是吧 卡特亚说过，他看到一个人能发4000条评论，而卡特亚的视频评论才2300个，一个人顶180万的up主，这就是嗓门的力量,2021-05-20 20:58:21
